{
  "type": "object",
  "additionalProperties": false,
  "required": [
    "model_version",
    "model_family",
    "graph_revision",
    "allow_direct_website_admission",
    "public_atlas_edges_admitted",
    "qualified_current_statutory_relationships",
    "edges"
  ],
  "properties": {
    "model_version": {
      "const": "0.1.0"
    },
    "model_family": {
      "const": "inc15e1-source-qualified-relationship-candidates"
    },
    "graph_revision": {
      "const": "publisher_source_observation_only"
    },
    "allow_direct_website_admission": {
      "const": false
    },
    "public_atlas_edges_admitted": {
      "const": 0
    },
    "qualified_current_statutory_relationships": {
      "const": 0
    },
    "edges": {
      "type": "array",
      "minItems": 0,
      "items": {
        "type": "object",
        "additionalProperties": false,
        "required": [
          "id",
          "from_id",
          "to_id",
          "relationship_type",
          "evidence_id",
          "source_snapshot",
          "qualification",
          "validity_start",
          "validity_end",
          "legal_effective_on",
          "legal_identity_claimed",
          "statutory_authority_claimed",
          "source_date_only",
          "actual_interagency_exercise_observed",
          "atlas_admitted",
          "source_inspection_required",
          "label_to_display"
        ],
        "properties": {
          "id": {
            "type": "string"
          },
          "from_id": {
            "const": "GOVMAN-2025-12-31"
          },
          "to_id": {
            "type": "string"
          },
          "relationship_type": {
            "const": "publisher_listing_of"
          },
          "evidence_id": {
            "const": "INC15E1-SRC-GOVMAN-ORIGINAL"
          },
          "source_snapshot": {
            "const": "GOVMAN-2025-12-31"
          },
          "qualification": {
            "const": "original_edition_directory_entry_verified"
          },
          "validity_start": {
            "type": "null"
          },
          "validity_end": {
            "type": "null"
          },
          "legal_effective_on": {
            "type": "null"
          },
          "legal_identity_claimed": {
            "const": false
          },
          "statutory_authority_claimed": {
            "const": false
          },
          "source_date_only": {
            "const": "2025-12-31"
          },
          "actual_interagency_exercise_observed": {
            "const": false
          },
          "atlas_admitted": {
            "const": false
          },
          "source_inspection_required": {
            "const": true
          },
          "label_to_display": {
            "const": "Publisher-listed entry (2025; not legally identified)"
          }
        }
      }
    }
  },
  "$schema": "https://json-schema.org/draft/2020-12/schema",
  "title": "ARFI INC-15E.1 inc15e1-source-qualified-relationship-candidates strict evidence contract",
  "description": "Source-only 2025 publisher identities and relationship types; law URL-only citations are unretained and cannot support legal or current-state claims."
}
