{
  "model_version": "0.1.0",
  "model_family": "inc15e1-source-qualified-relationship-candidates",
  "graph_revision": "publisher_source_observation_only",
  "allow_direct_website_admission": false,
  "public_atlas_edges_admitted": 0,
  "qualified_current_statutory_relationships": 0,
  "edges": [
    {
      "id": "INC15E1-PUBLISHER-EDGE-1",
      "from_id": "GOVMAN-2025-12-31",
      "to_id": "GOVMAN-2025-12-31:169",
      "relationship_type": "publisher_listing_of",
      "evidence_id": "INC15E1-SRC-GOVMAN-ORIGINAL",
      "source_snapshot": "GOVMAN-2025-12-31",
      "qualification": "original_edition_directory_entry_verified",
      "validity_start": null,
      "validity_end": null,
      "legal_effective_on": null,
      "legal_identity_claimed": false,
      "statutory_authority_claimed": false,
      "source_date_only": "2025-12-31",
      "actual_interagency_exercise_observed": false,
      "atlas_admitted": false,
      "source_inspection_required": true,
      "label_to_display": "Publisher-listed entry (2025; not legally identified)"
    },
    {
      "id": "INC15E1-PUBLISHER-EDGE-2",
      "from_id": "GOVMAN-2025-12-31",
      "to_id": "GOVMAN-2025-12-31:147",
      "relationship_type": "publisher_listing_of",
      "evidence_id": "INC15E1-SRC-GOVMAN-ORIGINAL",
      "source_snapshot": "GOVMAN-2025-12-31",
      "qualification": "original_edition_directory_entry_verified",
      "validity_start": null,
      "validity_end": null,
      "legal_effective_on": null,
      "legal_identity_claimed": false,
      "statutory_authority_claimed": false,
      "source_date_only": "2025-12-31",
      "actual_interagency_exercise_observed": false,
      "atlas_admitted": false,
      "source_inspection_required": true,
      "label_to_display": "Publisher-listed entry (2025; not legally identified)"
    },
    {
      "id": "INC15E1-PUBLISHER-EDGE-3",
      "from_id": "GOVMAN-2025-12-31",
      "to_id": "GOVMAN-2025-12-31:160",
      "relationship_type": "publisher_listing_of",
      "evidence_id": "INC15E1-SRC-GOVMAN-ORIGINAL",
      "source_snapshot": "GOVMAN-2025-12-31",
      "qualification": "original_edition_directory_entry_verified",
      "validity_start": null,
      "validity_end": null,
      "legal_effective_on": null,
      "legal_identity_claimed": false,
      "statutory_authority_claimed": false,
      "source_date_only": "2025-12-31",
      "actual_interagency_exercise_observed": false,
      "atlas_admitted": false,
      "source_inspection_required": true,
      "label_to_display": "Publisher-listed entry (2025; not legally identified)"
    },
    {
      "id": "INC15E1-PUBLISHER-EDGE-4",
      "from_id": "GOVMAN-2025-12-31",
      "to_id": "GOVMAN-2025-12-31:180",
      "relationship_type": "publisher_listing_of",
      "evidence_id": "INC15E1-SRC-GOVMAN-ORIGINAL",
      "source_snapshot": "GOVMAN-2025-12-31",
      "qualification": "original_edition_directory_entry_verified",
      "validity_start": null,
      "validity_end": null,
      "legal_effective_on": null,
      "legal_identity_claimed": false,
      "statutory_authority_claimed": false,
      "source_date_only": "2025-12-31",
      "actual_interagency_exercise_observed": false,
      "atlas_admitted": false,
      "source_inspection_required": true,
      "label_to_display": "Publisher-listed entry (2025; not legally identified)"
    }
  ]
}
